{
  "schema_version": "alpha.factor_evaluation_profile.v1",
  "profile_name": "cn-a-daily-cross-sectional-conservative",
  "policy": {
    "heuristics_are_industry_standards": false,
    "allow_compensating_score": false
  },
  "hard_gates": {
    "point_in_time": true,
    "historical_universe": true,
    "timing_validated": true,
    "trial_ledger_complete": true,
    "final_holdout_governed": true
  },
  "heuristics": {
    "rank_ic_watch_abs": 0.01,
    "rank_ic_strong_abs": 0.03,
    "icir_watch": 0.3,
    "positive_ic_ratio_watch": 0.55,
    "redundancy_review_abs_correlation": 0.75,
    "participation_rate_stress": 0.1,
    "pessimistic_net_alpha_must_be_positive": true
  },
  "required_dimensions": [
    "data",
    "predictive_power",
    "robustness",
    "multiple_testing",
    "tradability",
    "risk_exposure",
    "capacity",
    "redundancy",
    "incremental_value",
    "shadow",
    "monitoring"
  ]
}
